{
 "instruments": {
  "0": {
   "byte_00": 1,
   "sample_indices": [
    0,
    0,
    0,
    0
   ],
   "byte_05": 0,
   "byte_06": 0,
   "byte_07": 0,
   "vibrato_delay": 0,
   "vibrato_depth": 0,
   "vibrato_speed": 0,
   "byte_0b": 0,
   "unknown12": [
    1,
    255,
    255,
    255,
    0,
    0,
    0,
    0,
    0,
    0,
    0,
    0
   ],
   "row_speed": 1,
   "ushort_12": 0,
   "samples": [
    {
     "byte_02": 0,
     "is_bidirectional": false,
     "start_position": 0,
     "loop_start": 0,
     "loop_end": 0,
     "int_10": 0,
     "ushort_14": 0,
     "ushort_16": 0,
     "pitch": 0
    },
    {
     "byte_02": 0,
     "is_bidirectional": false,
     "start_position": 0,
     "loop_start": 0,
     "loop_end": 0,
     "int_10": 0,
     "ushort_14": 0,
     "ushort_16": 0,
     "pitch": 0
    },
    {
     "byte_02": 0,
     "is_bidirectional": false,
     "start_position": 0,
     "loop_start": 0,
     "loop_end": 0,
     "int_10": 0,
     "ushort_14": 0,
     "ushort_16": 0,
     "pitch": 0
    },
    {
     "byte_02": 0,
     "is_bidirectional": false,
     "start_position": 0,
     "loop_start": 0,
     "loop_end": 0,
     "int_10": 0,
     "ushort_14": 0,
     "ushort_16": 0,
     "pitch": 0
    }
   ],
   "rows": [
    {
     "relative_note_number": 0,
     "dont_use_note_pitch": false,
     "sample_index": 0,
     "byte_03": 0,
     "effects": [
      {
       "type": 0,
       "param": 0
      },
      {
       "type": 0,
       "param": 0
      }
     ]
    }
   ],
   "envelope": {
    "sustain": 255,
    "loop_start": 255,
    "loop_end": 255,
    "points": [
     {
      "x": 0,
      "interpolation": 0,
      "y": 255,
      "byte_05": 0,
      "ushort_06": 0
     }
    ]
   }
  },
  "1": {
   "byte_00": 0,
   "sample_indices": [
    1,
    0,
    0,
    0
   ],
   "byte_05": 0,
   "byte_06": 0,
   "byte_07": 0,
   "vibrato_delay": 0,
   "vibrato_depth": 0,
   "vibrato_speed": 0,
   "byte_0b": 0,
   "unknown12": [
    1,
    255,
    255,
    255,
    0,
    0,
    0,
    0,
    0,
    0,
    0,
    0
   ],
   "row_speed": 1,
   "ushort_12": 0,
   "samples": [
    {
     "byte_02": 0,
     "is_bidirectional": false,
     "start_position": 0,
     "loop_start": 2596,
     "loop_end": 2718,
     "int_10": 0,
     "ushort_14": 0,
     "ushort_16": 0,
     "pitch": 359
    },
    {
     "byte_02": 0,
     "is_bidirectional": false,
     "start_position": 0,
     "loop_start": 0,
     "loop_end": 0,
     "int_10": 0,
     "ushort_14": 0,
     "ushort_16": 0,
     "pitch": 0
    },
    {
     "byte_02": 0,
     "is_bidirectional": false,
     "start_position": 0,
     "loop_start": 0,
     "loop_end": 0,
     "int_10": 0,
     "ushort_14": 0,
     "ushort_16": 0,
     "pitch": 0
    },
    {
     "byte_02": 0,
     "is_bidirectional": false,
     "start_position": 0,
     "loop_start": 0,
     "loop_end": 0,
     "int_10": 0,
     "ushort_14": 0,
     "ushort_16": 0,
     "pitch": 0
    }
   ],
   "rows": [
    {
     "relative_note_number": 2,
     "dont_use_note_pitch": false,
     "sample_index": 1,
     "byte_03": 0,
     "effects": [
      {
       "type": 12,
       "param": 144
      },
      {
       "type": 0,
       "param": 0
      }
     ]
    }
   ],
   "envelope": {
    "sustain": 0,
    "loop_start": 255,
    "loop_end": 255,
    "points": [
     {
      "x": 0,
      "interpolation": 0,
      "y": 255,
      "byte_05": 0,
      "ushort_06": 0
     },
     {
      "x": 14,
      "interpolation": -4662,
      "y": 0,
      "byte_05": 0,
      "ushort_06": 0
     }
    ]
   }
  },
  "2": {
   "byte_00": 0,
   "sample_indices": [
    2,
    0,
    0,
    0
   ],
   "byte_05": 0,
   "byte_06": 0,
   "byte_07": 0,
   "vibrato_delay": 0,
   "vibrato_depth": 0,
   "vibrato_speed": 0,
   "byte_0b": 0,
   "unknown12": [
    1,
    255,
    255,
    255,
    0,
    0,
    0,
    0,
    0,
    0,
    0,
    0
   ],
   "row_speed": 1,
   "ushort_12": 0,
   "samples": [
    {
     "byte_02": 0,
     "is_bidirectional": false,
     "start_position": 0,
     "loop_start": 0,
     "loop_end": 0,
     "int_10": 0,
     "ushort_14": 0,
     "ushort_16": 0,
     "pitch": 1780
    },
    {
     "byte_02": 0,
     "is_bidirectional": false,
     "start_position": 0,
     "loop_start": 0,
     "loop_end": 0,
     "int_10": 0,
     "ushort_14": 0,
     "ushort_16": 0,
     "pitch": 0
    },
    {
     "byte_02": 0,
     "is_bidirectional": false,
     "start_position": 0,
     "loop_start": 0,
     "loop_end": 0,
     "int_10": 0,
     "ushort_14": 0,
     "ushort_16": 0,
     "pitch": 0
    },
    {
     "byte_02": 0,
     "is_bidirectional": false,
     "start_position": 0,
     "loop_start": 0,
     "loop_end": 0,
     "int_10": 0,
     "ushort_14": 0,
     "ushort_16": 0,
     "pitch": 0
    }
   ],
   "rows": [
    {
     "relative_note_number": 2,
     "dont_use_note_pitch": true,
     "sample_index": 1,
     "byte_03": 0,
     "effects": [
      {
       "type": 12,
       "param": 176
      },
      {
       "type": 0,
       "param": 0
      }
     ]
    }
   ],
   "envelope": {
    "sustain": 255,
    "loop_start": 255,
    "loop_end": 255,
    "points": [
     {
      "x": 0,
      "interpolation": 0,
      "y": 255,
      "byte_05": 0,
      "ushort_06": 0
     }
    ]
   }
  },
  "3": {
   "byte_00": 0,
   "sample_indices": [
    3,
    0,
    0,
    0
   ],
   "byte_05": 0,
   "byte_06": 0,
   "byte_07": 0,
   "vibrato_delay": 0,
   "vibrato_depth": 0,
   "vibrato_speed": 0,
   "byte_0b": 0,
   "unknown12": [
    1,
    255,
    255,
    255,
    0,
    0,
    0,
    0,
    0,
    0,
    0,
    0
   ],
   "row_speed": 1,
   "ushort_12": 0,
   "samples": [
    {
     "byte_02": 0,
     "is_bidirectional": false,
     "start_position": 0,
     "loop_start": 0,
     "loop_end": 0,
     "int_10": 0,
     "ushort_14": 0,
     "ushort_16": 0,
     "pitch": 1780
    },
    {
     "byte_02": 0,
     "is_bidirectional": false,
     "start_position": 0,
     "loop_start": 0,
     "loop_end": 0,
     "int_10": 0,
     "ushort_14": 0,
     "ushort_16": 0,
     "pitch": 0
    },
    {
     "byte_02": 0,
     "is_bidirectional": false,
     "start_position": 0,
     "loop_start": 0,
     "loop_end": 0,
     "int_10": 0,
     "ushort_14": 0,
     "ushort_16": 0,
     "pitch": 0
    },
    {
     "byte_02": 0,
     "is_bidirectional": false,
     "start_position": 0,
     "loop_start": 0,
     "loop_end": 0,
     "int_10": 0,
     "ushort_14": 0,
     "ushort_16": 0,
     "pitch": 0
    }
   ],
   "rows": [
    {
     "relative_note_number": 2,
     "dont_use_note_pitch": true,
     "sample_index": 1,
     "byte_03": 0,
     "effects": [
      {
       "type": 0,
       "param": 0
      },
      {
       "type": 0,
       "param": 0
      }
     ]
    }
   ],
   "envelope": {
    "sustain": 255,
    "loop_start": 255,
    "loop_end": 255,
    "points": [
     {
      "x": 0,
      "interpolation": 0,
      "y": 255,
      "byte_05": 0,
      "ushort_06": 0
     }
    ]
   }
  },
  "4": {
   "byte_00": 0,
   "sample_indices": [
    4,
    0,
    0,
    0
   ],
   "byte_05": 0,
   "byte_06": 0,
   "byte_07": 0,
   "vibrato_delay": 0,
   "vibrato_depth": 0,
   "vibrato_speed": 0,
   "byte_0b": 0,
   "unknown12": [
    1,
    255,
    255,
    255,
    0,
    0,
    0,
    0,
    0,
    0,
    0,
    0
   ],
   "row_speed": 1,
   "ushort_12": 0,
   "samples": [
    {
     "byte_02": 0,
     "is_bidirectional": false,
     "start_position": 0,
     "loop_start": 0,
     "loop_end": 0,
     "int_10": 0,
     "ushort_14": 0,
     "ushort_16": 0,
     "pitch": 1780
    },
    {
     "byte_02": 0,
     "is_bidirectional": false,
     "start_position": 0,
     "loop_start": 0,
     "loop_end": 0,
     "int_10": 0,
     "ushort_14": 0,
     "ushort_16": 0,
     "pitch": 0
    },
    {
     "byte_02": 0,
     "is_bidirectional": false,
     "start_position": 0,
     "loop_start": 0,
     "loop_end": 0,
     "int_10": 0,
     "ushort_14": 0,
     "ushort_16": 0,
     "pitch": 0
    },
    {
     "byte_02": 0,
     "is_bidirectional": false,
     "start_position": 0,
     "loop_start": 0,
     "loop_end": 0,
     "int_10": 0,
     "ushort_14": 0,
     "ushort_16": 0,
     "pitch": 0
    }
   ],
   "rows": [
    {
     "relative_note_number": 7,
     "dont_use_note_pitch": true,
     "sample_index": 1,
     "byte_03": 0,
     "effects": [
      {
       "type": 12,
       "param": 96
      },
      {
       "type": 0,
       "param": 0
      }
     ]
    }
   ],
   "envelope": {
    "sustain": 255,
    "loop_start": 255,
    "loop_end": 255,
    "points": [
     {
      "x": 0,
      "interpolation": 0,
      "y": 255,
      "byte_05": 0,
      "ushort_06": 0
     }
    ]
   }
  },
  "5": {
   "byte_00": 0,
   "sample_indices": [
    2,
    4,
    0,
    0
   ],
   "byte_05": 0,
   "byte_06": 0,
   "byte_07": 0,
   "vibrato_delay": 0,
   "vibrato_depth": 0,
   "vibrato_speed": 0,
   "byte_0b": 0,
   "unknown12": [
    1,
    255,
    255,
    255,
    0,
    0,
    0,
    0,
    0,
    0,
    0,
    0
   ],
   "row_speed": 1,
   "ushort_12": 0,
   "samples": [
    {
     "byte_02": 0,
     "is_bidirectional": false,
     "start_position": 0,
     "loop_start": 0,
     "loop_end": 0,
     "int_10": 0,
     "ushort_14": 0,
     "ushort_16": 0,
     "pitch": 1780
    },
    {
     "byte_02": 0,
     "is_bidirectional": false,
     "start_position": 0,
     "loop_start": 0,
     "loop_end": 0,
     "int_10": 0,
     "ushort_14": 0,
     "ushort_16": 0,
     "pitch": 1780
    },
    {
     "byte_02": 0,
     "is_bidirectional": false,
     "start_position": 0,
     "loop_start": 0,
     "loop_end": 0,
     "int_10": 0,
     "ushort_14": 0,
     "ushort_16": 0,
     "pitch": 0
    },
    {
     "byte_02": 0,
     "is_bidirectional": false,
     "start_position": 0,
     "loop_start": 0,
     "loop_end": 0,
     "int_10": 0,
     "ushort_14": 0,
     "ushort_16": 0,
     "pitch": 0
    }
   ],
   "rows": [
    {